commento;labelpers;tipo_lista;
"Nel 2014 avevo  soggiornato in questa struttura che mi aveva pienamente soddisfatta.  Orosei e il suo bel mare mi hanno  spinta a ripetere l'esperienza con mio marito e mia nipote di 12anni . Non ho avuto dubbi nel scegliere Mannois. Il concetto di albergo diffuso mi soddisfa pienamente, dislocato nel centro storico, ma funzionale , tutte le strutture sono a pochi minuti di distanza . Abbiamo alloggiato  a ""sa dommo"" in una ampia camera tripla con balcone con tavolino e poltrone , la cui pulizia era ineccepibile e profumatissima, il sonno fantastico. Se vogliamo l'unico neo il bagno senza aria  con ci«˝ che ne consegue. La colazione «˘ servita a Sa corte, casa madre,   in cui «˘ ubicata la reception: abbondante, varia,  con prodotti del territorio , dolci preparati dal cuoco ( torte, cannoli, paste, brioche ogni ben di Dio ) e salata ( ricotta, formaggi, salumi, uova, bacon ) frutta, succhi . Il personale «˘ numeroso, attento, simpatico, efficiente. Basta chiedere «˘ si «˘ accontentati. Altrettanto posso dire  di Emanuele, della straordinaria Emanuela prodighi di informazioni, suggerimenti, consigli sul territorio, sulle attivit«ˇ , sui offerti. Solleciti, discreti, con professionalit«ˇ straordinaria. L'albergo offre anche un valido servizio di biciclette, anche a pedalata assistita con cui «˘ agevole muoversi nel centro storico di Orosei, dove non «˘ facile parcheggiare,  e si percepisce un certo fastidio da parte degli abitanti nei confronti dei turisti. Non «˘ semplice aggirarsi in auto nelle strette viuzze del paese.  Ci«˝ esula dal giudizio  ultra positivo sulla struttura. Vorrei fare un plauso al lido Mannois, perfettamente attrezzato,  pulito, ordinato ma soprattutto gestito da fantastici ragazzi  sorridenti, simpatici che aggiungevano valore al bello stabilimento balneare.Consiglio a chi cerca semplicit«ˇ raffinata, senza ostentazione che non sia la qualit«ˇ del servizio, la professionalit«ˇ, l'efficienza, l'onest«ˇ nei prezzi per i servizi forniti. Un grande abbraccio a tutto il personale che ci ha fatto sentire in una grande famiglia.|st|TRAINING";lt;TRAINING;
Un albergo, specialmente quello delle vacanze, deve evocarti sensazioni, emozioni...E quando si sceglie lÉ??albergo diffuso Mannois, una struttura ricettiva dislocata in edifici diversi, si ha anche la possibilit«ˇ di É??personalizzareÉ?ù le proprie emozioni. Ho deciso in loco di prolungare il mio soggiorno e, a causa di una prenotazione gi«ˇ confermata, ho avuto la possibilit«ˇ di pernottare in una camera diversa dalla prima assegnata: ed «˘ proprio da questa mia esperienza che ho potuto assaporare unÉ??atmosfera diversa dalla prima. Sa Turre: una stanza luminosa e mediterranea, con una vista mozzafiato sui borghi di Orosei che si stendono a perdita dÉ??occhio fino al mare, arredi chiari e perfettamente in armonia con i giochi architettonici delle volte dei soffitti. Sa Corte: una stanza romantica e intima, con un balconcino che si affaccia sulla corte interna, sfondo indimenticabile per un aperitivo in attesa del tramonto, arredi minimal e architettura curata nel minimo dettaglio per conservare al massimo il fascino di quei borghi ricchi di charme.La prima colazione «˘ degna di un hotel lusso, con specialit«ˇ di alta pasticceria e un ricchissimo buffet che sapr«ˇ accontentare anche i palati pi«˚ esigenti. Non solo lo consiglierei vivamente, ma invito gli amici di TripAdvisor a visitare di persona questa sorprendente realt«ˇ per ammirare con quanto amore per la propria terra e con quanta dedizione sono stati sapientemente ricostruite ambientazioni e architetture, partendo da vecchie e dismesse abitazioni e riprendendo pazientemente ogni piccolo particolare che potesse richiamare la loro iniziale condizione. Per un full immersion nella vera Sardegna che piano piano sta scomparendo. Eccellente rapporto qualit«ˇ prezzo, personale attento e molto cordiale. Direi che definirlo hotel 4 stelle «˘ sicuramente riduttivo, perch«∏ i servizi offerti non hanno nulla da invidiare ad un resort pi«˚ titolato.;rs;TRAINING;
Piacevole struttura, personale cortesissimo, ben organizzato. Pulizia ed efficienza, buona base per le meravigliose escursioni nella zona. Silenziosa e tranquilla, consigliabile per soggiorni sia brevi ch lunghi. Buona la colazione. Suggerimenti? Attenzione al link con il ristorante Sa Turre, le luci nelle camere potrebbero essere migliorate, in particolare il lampione nel cortile.;rs;TRAINING;
Anche se il tempo non «∏ stato dei migliori (pioveva a dirotto) abbiamo deciso di fare tutto il tragitto da Porto Torres fino a Orosei... 2 ore e mezza per godere di questo piccolo paradiso che ha mantenuto le promesse date. All∂Ôarrivo ha addirittura smesso di piovere ;it;TRAINING;
Dormiamo ad Orosei dove siamo per la prima volta. Signora all'accoglienza molto gentile e disponibile. Camera molto carina, pulita e silenziosa. Accogliente.Ristorante chiuso perch«∏ fuori stagione ma i suggerimenti datici sono stati anche molto gentili ed interessanti. Da tener presente.;it;TEST;
Albergo diffuso di immensa bellezza le stanze comprendono il bagno e sono curate nei minimi dettagli in stile sardo molto accoglienti e pulite e estremamente confortevoli. Viene servita una colazione a buffet molto varia e abbondante e tutto buonissimo. Consigliatissimo!!;rs;TEST;
Abbiamo soggiornato qui per 4 notti e la nostra vacanza «˘ stata stupenda. La prima sera siamo arrivati in ritardo al check in e il ragazzo della reception si «˘ offerto di aspettarci per ben due ore!!I Ragazzi che lavorano in questoalbergo sono Gentilissimi e sempre disponibili, dalla signora che serviva i cappuccini alla mattina, a quelli della reception che ci davano sempre ottimi consigli su dove mangiare o cosa visitare. L'ultima sera, quando abbiamo detto alla ragazza della reception che saremmo partiti l'indomani prima della colazione si «˘ persino offerta di farci un pacco colazione da prenderci su per il viaggio! Che dire?? Meglio di cos«™ non poteva andare! Staff fantastico!!;st;TEST;
Piacevole soggiorno per chi cerca privacy, indipendenza e qualit«ˇ. Ho soggiornato con il mio fidanzato nell'appartamento de luxe   : tutto nuovissimo, pulizia eccellente , stoviglie pulitissime e nuove , letto molto comodo e . stabile sapientemente ristrutturato, comodo per le varie escursioni e poi parcheggio pubblico adiacente , il centro si raggiunge tranquillamente a piedi,panetteria con prodotti freschi e deliziosi sotto casa, macelleria con con carni locali e bar. Stra-consigliato;it;TEST;
Abbiamo soggiornato per 8 gg al Mannois sulla scorta delle ottime recensioni e perch«∏ preferiamo ogni anno scoprire zone che non conosciamo di questa meravigliosa isola. Pertanto la scelta «˘ ricaduta su Orosei.  L hotel «˘ molto curato con gusto nelle parti comuni  dove si pu«˝ gustare un'eccellente colazione che pu«˝ soddisfare tutti i gusti per variet«ˇ e qualit«ˇ.  Bella la camera con pulizie giornaliere perfette. Simpaticissimo il servizio bike che ci ha consentito di raggiungere la spiaggia in circa 20 minuti  attraverso un bel percorso in buona parte pista ciclabile.  Servizio spiaggia perfetto comodissimo e con ombrelloni molto distanziati.  Personale di servizio professionale e gentilissimo tra  cui Anna regina delle colazioni che ci ha anche suggerito qualche percorso alternativo all interno che si «˘ rivelato perfetto. Il paese di Orosei «˘ stata una piacevole sorpresa con centro storico curato e grazioso con esercizi commerciali anche gradevoli. Consiglio anche la visita su spiagge limitrofe quale Su Barone, Bidderosa, Bircheda. Interessantissima la visita alla sorgente di Su Gologone (sempre suggerito da Anna).;it;TRAINING;
inizio col scrivere che Davide il ragazzo che ci ha accolti nella struttura distaccata dell'hotel cio«˘ nel Loft, «˘ una persona GENTILISSIMA e molto disponibile, ci ha anche prenotato la minicrocera e il ristorante.il Loft «˘ un incanto, avevamo il numero 8, vista mare e montagna, camera arredata con gusto, veranda comodissima con frigo piano ad induzione microonde lavello e vari accessori essenziali, utilissimo per chi viaggia con bimbi piccoli come noi, preparando la pappa prima delle giornate passate al mare.letto comodissimo, culla fornita gratuitamente,   bagno molto grande e funzionale.L'intero alloggio pulito impeccabilmente, un 10 e lode.Sicuramente consiglier«˝ questo alloggio a chi vorr«ˇ trascorrere una vacanza ad Orosei, sicuramente ci ritorneremo.un caro saluto a tutto lo staff e buon lavoroYlenia, Stefano «˘ Mattia;st;TRAINING;
Un soggiorno eccellente. Abbiamo scelto l hotel per la nostra luna di miele. Struttura incantevole per posizione ottima e scenario. Vista mare dalla colazione alla cena. Piscina da favola. Staff gentilissimo professionale e molto disponibile. Al nostro arrivo regalo di benvenuto molto gradito per la nostra luna di miele. Siamo stati aiutati nella scelta delle escursioni e ci hanno consigliato spiagge e locali. Ottimo il servizio di navetta. Grazie allo staff non vi dimenticheremo mai. A presto i novelli sposi Serena e Mattia.É?›;st;TRAINING;
Hotel da classificare come il classico internazionale dotato di molte camere. La struttura Si trova in una zona panoramica, vicino alla parte industriale di Olbia, a pochi minuti dal centro.  Comodo se si «˘ in auto per girare le calette vicino Pittolungo e golfo Aranci, a mezzÉ??ora di auto si pu«˝ andare a San Teodoro e Porto Cervo. Parcheggio un poÉ?? piccolino. Diciamo che La Piscina panoramica «˘ il suo punto di forza.  La Camera con terrazzo «˘ ampia e arredata di tutto il necessario, peccato che su un criterio di hotel 4 stelle sia la camera che il bagno siano un poÉ?? datati, doccia con vasca scomoda e abbiamo rinunciato a farci il bagno perch«∏ lÉ??acqua era gialla. Terrazza con bella vista su Olbia, ma con poca intimit«ˇ in quanto il muretto confinante con la camera adiacente praticamente «˘ inesistente.  Il Personale «˘ stato gentile. La Colazione internazionale abbastanza ricca, anche se a mio giudizio troppo molto fai da te e con prodotti confezionati, la cosa positiva «˘ che si pu«˝ fare con un ottima vista panoramica. Peccato che alcuna clientela non fosse molto educata, rovinando il momento relax della colazione.  Soggiorno tutto sommato positivo, ma non allÉ??altezza di altri 4 stelle della Sardegna, sia come struttura che come qualit«ˇ prezzo. É?›;lt;TEST;
Sono andata a leggere le recensioni negative per capire cosa le persone avessero potuto trovare di sbagliato in questo albergo, e infatti sono totalmente fuorvianti. Raramente ho visto un posto tanto bello, camere comodissime (finalmente un letto con materasso matrimoniale!!!) con vista indimenticabile, kit cortesia con addirittura la crema doposole, bagno strapulito e acqua che arriva calda in un secondo. La cena ottima in unÉ??atmosfera raffinata, che allo stesso tempo non fa mai sentire lÉ??ospite a disagio, personale di una cortesia e discrezione rara. Per la cena sono attrezzati anche per i pi«˚ piccoli con fogli da disegnare, matite colorate e piatti e bicchieri per bambini, hanno avuto unÉ??attenzione per il mio bimbo mai vista prima. Colazione spettacolare, con prodotti tipici, vista mare e piscina. LÉ??unica cosa negativa che ho trovato di questo posto «˘ stata dover ripartire!É?›;st;TRAINING;
Una serata in relax....Aperitivo di noi OLBIESI alternativo e panorama fantastico....personale professionale e cocktail fatti benissimo..Panorama «˘ solo da vederlo di persona,rilassante!!!Provare x credere...;st;TEST;
Ho soggiornato per alcuni giorni con mia figlia nel 2017.  Un hotel molto ben posizionato, dotato di tutti i confort. Personale gentilissimo e sempre attento ai bisogni del cliente.  Ristorante dell'hotel eccellente. Ci torner«˝ sicruramente  per un soggiorno pi«˚ lungo.;ht;TEST;
Sicuramente l'hotel si trova in una posizione privilegiata e gode di una vista mozzafiato.La piscina «˘ il punto forte di questa struttura (basta guardare le foto, non servono altre parole!) Il giardino, cos«™ come tutti gli spazi sia esterni sia interni «˘ curato nei minimi dettagli.Abbiamo avuto l'opportunit«ˇ di soggiornare in una suite davvero favolosa! Due piani, due bagni e due grandi terrazzi con vista sul porto e accesso diretto alla piscina. Il tutto accuratamente pulito e ordinato.Ci siamo sentiti davvero a casa! Il personale dell'hotel «˘ davvero molto gentile e disponibile ad ogni richiesta.La colazione «˘ davvero infinita: ogni tipo di dolce,  biscotti, marmellate, succhi di frutta, yoghurt, affettati, uova, bacon e tante altre cose..Abbiamo anche pranzato nel ristorante dell'hotel e abbiamo mangiato davvero molto bene!Hotel consigliatissimo!;rs;TRAINING;
Tutte le camere dell'hotel sono fantastiche ma non dovete perdervi la suite, vale ogni singolo euro speso. Ha l'accesso diretto in piscina, veranda con 3 lettini, soppalco con seconda zona notte e bagno separato. Ha la doppia vista: su Olbia e il tramonto e su tavolara el'alba. Regalatevi questo sogno. Colazione da 10 e lode, personale al top. Flavia;lt;TEST;
Semplicemente perfetto! Personale gentilissimo, camere pulitissime, colazione abbondante e buffet sempre rifornito, piscina ampia con vista panoramica, parcheggio disponibile in loco e rapporto qualit«ˇ prezzo perfetto! Grazie per il bel soggiorno!;vs;TEST;
Ci,sono stata per lavoro, purtroppo una notte e via...ma la mattina presto .... uno spettacolo... la colazione sulla veranda: bellissima! Un appunto ma per una coerenza con la categoria dell'Hotel: la colazione dovrebbe essere pi«˚ accurata, con una presentazione migliore ... il latte NON era FRESCO ma alunga conservazione: un peccato! Gli affettati, i,formaggi disposti male, e non davano 'valore'all'Hotel!,;lt;TEST;
Abbiamo alloggiato la prima settimana di agosto. Confermo tutte le recensioni positive. Il rapporto qualit«ˇ prezzo tutto sommato va bene. Eravamo con la formula pernotto e colazione, ed abbiamo inoltre usufruito del ristorante a pranzo un paio di volte. Ci siamo trovati molto bene, il personale sempre gentile e disponibile pulizia adeguata. Un p«˝ vetusta la moquette nei corridoi. Posizione strategica,  zona piscina con panorama mozzafiato. Consigliato.;vs;TRAINING;
Tornerei e consiglierei questo albergo. Il personale «˘ gentile e disponibile. Camera pulita abbastanza grande e chiara. Nel nostro caso con vista sul porto di Olbia. Il prezzo per il mese di Giugno ok;vs;TEST;
Posizione eccezionale, camere pulite e abbastanza spaziose, personale molto gentile e disponibile, piscina fantastica. Cibo ottimo. Vista sul porto di Olbia in lontananza molto suggestiva, soprattutto la sera. Ottimo punto di partenza per visitare  la  Costa Smeralda. Torneremo certamente.;rs;TRAINING;
Che dire lÉ??hotel «˘ situato in unvuna posizione stupenda!La camera «˘ silenziosa,il letto comodo,i camerieri gentilissimi,il personale della camera e alla reception anche!La PISCINAAAAA–???–??çsconfina il blu cn lo smeraldo del maree..tto intorno il prato verde,il cielo azzurro,i fiori,il profumo del mirto ovunque!Al ristorante abbiamo cenato1volta la sera della cena tipica sarda,servizio impeccabile,qualit«ˇ eccellente.Colazione ottima si fa davanti alla piscina..insomma un paradiso,per la spiaggia cÉ??«˘ la comodissima navetta..tornerei subito!!;lt;TEST;
L∂Ôhotel si trova sulla strada che porta al golfo aranci, una piccola collina che sovrasta il porto di Olbia. Circondato da un bel parco e con una piscina spettacolare a vista sul mare. Camere grandi, pulite e confortevoli. Hotel molto tranquillo. Colazione ricca, sia salata che dolce. Personale molto gentile e disponibile. Ottimo servizio navetta, gratuito, da e per l∂Ôaeroporto.L∂Ôunico neo sono i prezzi del ristorante e bar che trovo veramente eccessivi. Per muoversi fuori dall∂Ôhotel la macchina e∂Ô d∂Ôobbligo. Con prezzi piu∂Ô bassi sarebbe un hotel al TOP. Comunque consigliato per un breve soggiorno.;vs;TEST;
Ho soggiornato in questo hotel per nove giorni. Tutto funziona benissimo. Efficienza nel check-in, buon servizio, meravigliosa colazione con dolci fatti in casa e abbondante scelta di salato, bevande. Ma il pezzo forte che, oserei dire, vale met«ˇ soggiorno «˘ la piscina! Da sogno! Infinita, in posizione panoramica....;vs;TRAINING;
Bellissimo hotel per chi vuole rilassarsi immerso nel verde e a pochi minuti di navetta (gratuita) dalla spiaggia di Pittulongu. Personale disponibile e cordiale! Stanze pulite, cibo ottimo, vista fantastica, piscina top.Consigliatissimo!;vs;TEST;
Ho soggiornato in questo hotel 2 notti  con mio marito per festeggiare il nostro primo anniversario di nozze. Siamo arrivati prima dell'orario previsto del check-in e con grande sorpresa la nostra camera era gi«ˇ pronta! La piscina «∏ senz'altro il punto di forza dell'hotel.. non ci sono parole per descrivere l'immensit«ˇ del paesaggio che si ammira dalla piscina..tutto molto suggestivo! La colazione «∏ ricca e di qualit«ˇ, impossibile non essere soddisfatti.. c'«˘ veramente di tutto! Abbiamo pranzato con salmone fresco alla griglia e  con patate al forno e insalata e calamari freschi. Tutto buonissimo, abbondante ed economico (13 euro a piatto). Il personale «˘ simpaticissimo,educato, professionale e pronto a soddisfare ogni richiesta del cliente. Questo hotel merita le molto pi«˚ di 5 stelle se fosse possibile! Complimenti vivissimi.. ci ritorneremo sicuramente!;vs;TEST;
Ambiente bello e molto pulito.Servizio veloce ma alcuni camerieri molto accigliati..... in questo lavoro «˘ importantissima la presenza di personale garbato e sorridente e qui questo non «˘ stato tale.Il pranzo abbastanza soddisfacente......non ho trovato nulla per«˝ di eccezionale!!!;st;TEST;
