,utente,commento,hotel,dataIns,rating
0,luca m,"È la quarta volta che soggiorniamo presso qs struttura e ci siamo sempre trovati benissimo. Quest'anno abbiamo pernottato nelle nuovissime camere appena realizzate,che dire molto molto belle,confortevoli e ben insonorizzate. Il servizio ristorante sempre eccellente e i camerieri super disponibili(grazie Antonio). Molto disponibili e pronte a soddisfare ogni richiesta le ragazze/zi della receptions. È in fase di ultimazione un importante ristrutturazione che lo renderà ancora più elegante e confortevole. Sicuramente se dovessimo ritornare a Rimini nn avremmo dubbi dove soggiornare. Grazie a tutti Luca e famiglia…",Hotel Sporting Rimini,2019-07-05,5 stelle
1,belladonnadaniele,"Albergo pulito, colazione ottima ed abbondante. Posizione centralissima, uniche 2 pecche, parcheggio inesistente, non danno nemmeno dei pass per poter parcheggiare nelle strisce blu come invece mi avevano detto al telefono, il portiere notturno mi ha detto che potevo metterla nel parcheggio interno alla modica cifra di 20€ a notte! Check-in dalle 14, fino le 15 la camera non era pronta.…",Hotel Sporting Rimini,2019-07-05,4 stelle
2,giulyso75,"Abbiamo trascorso cinque giorni in questo hotel, tutto perfetto dal ricevimento, alla camera, ai pasti. Situato fronte mare offre un panorama stupendo, bella la piscina per quando il mare non è bellissimo. I miei bambini sono stati molto bene, si sono divertiti in piscina e il piccolo alla sera andava agli spettacoli e ai giochi al cineclub, grazie Sofia!!!!! La sala da pranzo ben curata, camerieri gentili e disponibili, il buffet vario, un po' per tutti i gusti. Unico neo, che secondo me non va bene, è  la moquette nelle camere. La struttura sta per essere ultimata e a fine lavori sarà al top. Grazie sicuramente torneremo!!!!!…",Hotel Sporting Rimini,2019-07-05,4 stelle
3,Marty S,"Abbiamo passato 7 giorni in questo splendido hotel e ci è dispiaciuto andare via perché siamo stati veramente bene: la posizione dell'albergo è ottima a pochissimi passi dal mare e una zona della città molto viva, non abbiamo mai usato la macchina in 7 giorni. Ottimo ristorante a partire dalla colazione molto varia fino alla cena con un buffet ricco. Mini club per bambini con animatrici molto brave e simpatiche camere ampie con un bel terrazzino. Unica pecca è che ci siamo trovati in periodo di lavori di ristrutturazione e quindi ci sono stati alcuni inconvenienti, a partire dai pochi posti disponibili nel parcheggio privato e dall'assenza di una rampa d'accesso, a passeggini e disabili, all' interno dell'hotel. In questo caso sarebbe stata utile una rampa prossivoria posizionata sulle scale.…",Hotel Sporting Rimini,2019-07-05,5 stelle
4,Luca N,"Hotel molto bello, vista mare facile da raggiungere, tre stelle perché 5 è il massimo e non trovare parcheggio non è il massimo, la camera bella il bagno da rivedere, doccia piccola con portasapone altezza testa con il quale ci si può far male (mai visto niente di simile) ricevimento tutti molto gentili e disponibili, molto pulito.  Nota negativa la cena, avendo chiesto di cenare ci è stata data la possibilità.... Però alle 21.30 anno iniziato a portare via il buffet come prassi probabilmente di chi sceglie la mezza pensione.... Se chiedo di cenare ed arrivo alle 21 non possono smontare alle 21.30 questo il motivo principale delle 3 stelle…",Hotel Sporting Rimini,2019-07-05,3 stelle
5,Angelo R,"Al di là del fatto che a Rimini si paga ANCHE L'ARIA, l'hotel è accogliente. Ero a Rimini per un convegno e non ho dormito qui, ma al Continental (dello stesso gruppo). Il servizio è ottimo, ma hanno avuto qualche problema di intasamento al nostro arrivo. La cosa che mi ha infastidito è stata l'assoluta assenza di organizzazione nel soddisfare la richiesta di parcheggio auto. Come si fa ad organizzare convegni senza disponibilità di posti auto in un posto (Rimini) dove per parcheggiare occorre pagare circa trenta euro al giorno?",Hotel Sporting Rimini,2019-07-05,3 stelle
6,Flavia M,"Ogni volta che arrivo al hotel Sporting è una grandissima Gioia, vengo accolta come a casa. Ci sono persone che mi coccolano e mi trattano come una perla preziosa; sempre gentili sempre a disposizione sempre pronti ad esaudire ed anticipare ogni singola richiesta. Tanti amici cari che offrono davvero un  servizio eccellente. Il cibo o sempre abbondante e buonissimo. Per me l'hotel Sporting  è 5 stelle a 360°. F. M.",Hotel Sporting Rimini,2019-07-05,5 stelle
7,Emiliano170272,"Ottimo hotel!Peccato che è in corso una ristrutturazione e il prospetto così come le camere non sono tutte disponibili.Posizione centralissima.Ottimi comfort e facilitiesLocali raffinati, moderni e di gusto Colazione eccellente!!!",Hotel Sporting Rimini,2019-07-05,4 stelle
8,paola p,"abbiamo soggiornato per una notte con cofanetto Emozione 3 nel primo weekend di giugno, nessun problema di prenotazione, servizio eccellente, ci è stata assegnata una camera con terrazzino vista mare dotata di ogni comfort, bagno completo con ottimo set di cortesia. Personale cortese e molto disponibile. Bella piscina con lettini a disposizione degli ospiti. Sala colazione molto elegante e curata con vetrata panoramica, vasta scelta sia dolce che salata ed orario molto flessibile. Super consigliato",Hotel Sporting Rimini,2019-07-05,4 stelle
9,abcd02,"personale ottimo, belle stanze, cucina casalinga ma accurata, solo..... non chiedete le stanze vista mare, non si dorme a causa dei locali sul lungo mare, o degli eventi che l'hotel organizza in piscina. Meglio affacciarsi e vedere le colline....per altro le stanze sul lato interno sono rinnovate e davvero bellissime.",Hotel Sporting Rimini,2019-07-05,4 stelle
10,Santo L,"Sono stato al ristorante dell'hotel Sporting perché come alloggio utilizzavo l'ambasciatore hotel. Il pranzo era buono e molto variegato distribuito a buffet per cui si trovava sua carne che pesce, verdure, frutta e dolci. Organizzazione molto scarsa in quanto ci è capitato di dovere aspettare per mancanza di tavoli pur avendo prenotato con largo anticipo i posti di cui si aveva bisogno. Infine il buffet era situato in una posizione non felice per cui vi erano sempre interminabili file. Che dire come consiglio, la prossima volta fate tesoro di questi rilievi. Auguri",Hotel Sporting Rimini,2019-07-05,3 stelle
11,Raffaele T,"4 stelle di buon livello, ristrutturato quasi completamente (quando ho soggiornato stavano completando le terrazze). Camera confortevole con TV a schermo piatto, WIFI, bagno rifatto, pulito. Forse  un hotel anonimo per vacanze, ma ottimo per soggiorni di lavoro. Personale gentile e professionale.",Hotel Sporting Rimini,2019-07-05,4 stelle
12,Alberto S,Ho soggiornato solo una notte con formula B&B. Stanza molto pulita e confortevole. Leggermente rumorosa l'aria condizionata (come nella gran parte degli hotel). Colazione continentale molto varia e personale gentile.,Hotel Sporting Rimini,2019-07-05,4 stelle
13,Pietro D,Sono stato per un evento ed ho potuto apprezzare la cortesia del personale e la disponibilità di sale x eventi. Buono e molto ricco il buffet. Situato a pochi metri dalla spiaggia da consigliare anche per un periodo di vacanza essendo nel cuore della Rimini balneare.,Hotel Sporting Rimini,2019-07-05,4 stelle
14,sandman3957,"Camera molto spaziosa, completamente rifatta, con un bagno bellissimo. Buona cucina, con vasto buffet, servizi generali di livello. Sono in corso dei lavori di ristrutturazione, ma i disagi sono minimi.",Hotel Sporting Rimini,2019-07-05,4 stelle
15,Liliiith,"Si respira aria di professionisti, ogni membro dello staff ha il compito di ""coccolare"" il cliente (difficile da trovare di questi tempi). All'interno di questa struttura gli ambienti completamente nuovi, dal design ricercato ed elegante, personale professionale e gentile.Stanza meravigliosa con balcone privato vista lungomare.Prima colazione eccellente.",Hotel Sporting Rimini,2019-07-05,4 stelle
16,Christian_Fu,"Perché registrate la vostra struttura tra quelle disponibili per un soggiorno con Smartbox se poi non accettate prenotazioni tramite lo stesso, indipendentemente dalla disponibilità o meno? Perché? Evitate queste pessime figure.",Hotel Sporting Rimini,2019-07-05,1 stelle
17,Rosalba,"Ho chiamato per prenotare nel mese di giugno una notte, visto che mi è stata regalata una smartbox per una notte  più colazione ma mi è stato detto che non prendono prenotazioni con le smartbox perché in genere hanno sempre le solite famiglie che ogni anno vengono a farsi le vacanze a Rimini, non si è neanche preoccupata di guardare la disponibilità, vergognoso, perché convenzionarsi con le smartbox quando poi decidono loro chi ospitare e quando.",Hotel Sporting Rimini,2019-07-05,1 stelle
18,Cinzia P,"Pulizia impeccabile, personale molto cordiale, sala ristorante molto spaziosa colazione ottima ,camera molto accogliente, bagno con doccia idro, unica nota dolente la mancanza di accappatoi; ci torneremo al più presto.",Hotel Sporting Rimini,2019-07-05,5 stelle
19,adnanamichele,Stanze grandi e pulite... Personale gentile e cordiale ; pronti ad aiutare e rispondere ad ogni vostra richiesta... Posizione ottima... La colazione è variegata e le torte sono deliziose ... Ci tornerò volentieri...,Hotel Sporting Rimini,2019-07-05,5 stelle
20,stefano d,"Ciao a tutti. Come sempre per lavoro sono in giro ed ora, da novembre 2018 a marzo 2019 mi trovo e troverò nel residence di cui scrivo per condividere le mie esperienze. Premetto che venni qui nel lontano 2006 (boh!!) Con la compagna di allora è prendemmo una stanza per due. Subito mi rendetti conto della qualità del posto che, contrariamente a tanti altri residence a Milano, aveva la finestra su ogni stanza.....miracolo!!!!! Anche in bagno!!!!! Cmq posto elegante...sincero...ospitale anche se immerso in una Sesto San Giovanni che offre ben poco ad un single in cerca di emozioni. Cmq se siete esperti di residence provate questo e, nella fascia economica che li compete, sono sicuro che lo apprezzerete per tanti piccoli ma importanti particolari. Bagno piccolo ma ben attrezzato....cucina ben arredata e in salotto ma...i residence sono così.....personale gentile ed educato...in particolare la padrona molto professionale...insomma...guardate le foto del sito perché veritiere. Alla prossima gente.…",CP Residence,2019-07-05,5 stelle
21,Debora R,Ho trascorso una settimana presso CP residence e mi sono trovata benissimo. Il mio monolocale era confortevole pulito e curato. La proprietaria Luana è stata sempre gentile e disponibile. Se dovessi risoggiornare a Sesto sceglierei nuovamente questa struttura.,CP Residence,2019-07-05,5 stelle
22,DottorCali,"Ho soggiornato per lavoro due volte nel giro di un mese, una volta al piano terra, una volta in una presunta suite. Camera piano terra carina, ma piuttosto rumorosa fino a un certo orario a causa della reception affianco, per il resto carina, aveva i fuochi per cucinare, bei bicchieri e ho apprezzato nel bagno la schiuma da barba col rasoio. La suite a prima vista è bellissima, con una doccia enorme multifunzione... Peccato che il pannellino non funzionava e la reception era sempre chiusa quando ero presente in hotel... Mediaset premium non ha mai funzionato. Io pavimento in marmo rende l'ambiente freddo, chissà come si sta in inverno... Nella suite inoltre mancava il rasoio e la schiuma, inoltre il telecomando del tv della camera aveva le batterie scariche... Insomma, migliorando queste piccole cose migliorerebbe il tutto!…",CP Residence,2019-07-05,3 stelle
23,Giovanna S,"Sito in una zona molto tranquilla e silenziosa, il residence è elegante e confortevole. Stanza bella e pulita, con tutti i comfort. Ideale per chi vuole trascorrere un weekend in relax. Accoglienza 10 e lode. Grazie Luana!!!",CP Residence,2019-07-05,5 stelle
24,Honeyluv12,"Abbiamo alloggiato in questo residence per un week-end, la pulizia eccellente e la cordialità dello staff hanno contraddistinto questo luogo! Zona tranquilla, numerosi bar, ristoranti e supermercati nelle vicinanze! Collegata bene con Milano grazie al servizio autobus e Metro a pochi passi! Complimenti in particolare alla signora Silvia che ci ha aiutati in tutti i modi possibili avendo avuto problemi con il treno causati dal guasto alla stazione centrale di Roma.. che dire, lo consiglio assolutamente sia per la cura dedicata alla pulizia, sia per i confort degli appartamenti che per la disponibilità!! Grazie ancora spero di tornare preso!!!!…",CP Residence,2019-07-05,5 stelle
25,Antonella T,"Consiglio il soggiorno in questo hotel/resident...Le foto pubblicate nel sito corridpondono alla realta'.Pulito, titolari gentili e disponibili,ottima posizione e vicinissimo alla metro ed autostrada,parcheggio.",CP Residence,2019-07-05,5 stelle
26,aurora0954,"Abbiamo alloggiato al CP Residence per 2 mesi in attesa della ristrutturazione del nostro appartamento.La struttura è molto carina, l'accoglienza e la disponibilità dello staff sono ottime.Il servizio di pulizia è molto buono.Siamo stati veramente bene.",CP Residence,2019-07-05,5 stelle
27,Avvoc,"Ho alloggiato per motivi di lavoro.È' collocato non molto lontano dalla stazione di Sesto 1 Maggio immerso in un oasi di verde. La gentilezza, l'accoglienza, la pulizia delle camere i confort di cui sono dotate le camere mi hanno fatto sentire a casa. Lo consiglio è un' ottima struttura.Grazie a tutto lo Staff",CP Residence,2019-07-05,5 stelle
28,StefaniaUgliano,"Accoglienza eccezionale, e' gestito in modo esemplare, estrema disponibilità'.Stanze con tanti confort, lussuose e  prezzi ottimi.Si respira armonia.Ambiente ottimo, ospiti discreti, ben frequentato.Curato nei particolari all'interno; circondato da verde all'esterno. Davvero un residence confortevole.Prezzi decisamente inferiore rispetto ai servizi offerti.",CP Residence,2019-07-05,5 stelle
29,Anna C,"Ho soggiornato in questo residence due volte e per motivi di lavoro.  Mi fu consigliato da amici che sono spesso a Milano. Il residence nel rapporto qualità - prezzo è imbattibile.  La struttura offre servizi di alto profilo che rendono  piacevole e confortevole il soggiorno. Il residence è posizionato ottimamente, a pochi passi da bar, supermercati, negozi di vario genere e a pochi minuti dalla fermata del treno di Sesto San Giovanni, se si proviene da Milano centro o per raggiungere punti principali della città. Interna alla struttura ci sono distributori di bibite calde e fredde, e di snack.  La ritengo la migliore struttura per la pulizia delle camere,  il confort che le stesse offrono,  consistenti in camere spaziose e dotate di angolo cottura con tutti gli utensili necessari. L'accoglienza è calorosa, sembra di stare a casa  !! Il simpatico personale è gentile, fa del proprio meglio per soddisfare i desideri e le necessità dei propri clienti.  La proprietaria,  Luana,  è una persona piacevole, la quale non di rado è pronta ad accompagnarvi in piacevoli chiacchiere.  Lo consiglio vivamente. Anna",CP Residence,2019-07-05,5 stelle
30,Enrico G,"Mi sono fermato diverse volte a dormire in questo residence tutto nuovo e molto ben curato. La sig.ra Luana è disponibilissima e gentilissima, il residence offre camere tutte nuove adattissime per fermarsi qualche giorno (o anche una sola notte). Considerata la qualità i prezzi sono super. Ottimo per chi partecipa alle fiere e deve sostare qualche giorno.",CP Residence,2019-07-05,4 stelle
31,Alessandro,"Ottima struttura, ho soggiornato qui piu di una volta ed è sempre pulita e ben messa, angolo cottura con l indispensabile e la struttura è strategicamente ubicata vicino ad austrate....propretari sempre disponibili",CP Residence,2019-07-05,5 stelle
32,Rexino7542,Sono stato al residence cp la scorsa settimana con la mia famiglia. Ho trovato la sistemazione pulita e confortevole oltre alla meravigliosa ospitalità dei titolari e dipendenti. Consiglio vivamente e se torno a Milano sarà sicuramente la mia sistemazione alloggiativa....,CP Residence,2019-07-05,5 stelle
33,Paola S,Visita di quattro giorni in questo residence per visita expo...tutto molto bello.. Interni curati e puliti...bagno spazioso con tutti i confort...personale davvero gentile e disponibile ..ci ritornerò di sicuro,CP Residence,2019-07-05,4 stelle
34,Niccolò C,"In viaggio per affari mi sono imbattuto in questa bellissima struttura che offre oltre all'estrema cordialità dello staff, una sistemazione molto al di sopra delle 3 stelle. Le camere sono bellissime e pulite, moderne e accessoriate.La cucina, la vasca da bagno e la TV via cavo le danno sicuramente una marcia in più.Purtroppo non si fa colazione, ma se prenoti un residence né si consapevole gin dall'inizio.Ottima struttura. Consigliatissimo!!!!",CP Residence,2019-07-05,5 stelle
35,pamelareiban,"Sono stata lì ad agosto!! Per visitare l'Expo!! È una struttura bellissima, dotata di tutti i confort possibili!! Le camere pulitissime,,Con un odore paradisiaco,, sono rimasta contentissima e con voglia di tornare già domani!! Arrivederci",CP Residence,2019-07-05,5 stelle
36,brunopicone,"Arrivo da Napoli per una visita Expo ottima struttura dotata di ogni confort sopratutto per periodi prolungati  perché e dotato di angolo cottura completo di tutto il necessario stoviglie ecc .personale eccellente,  molto pulito, comodo per la metropolitana.",CP Residence,2019-07-05,5 stelle
37,Gianluca F,"Struttura utilizzata da un gruppo di 10 amici, utilizzando 3 camere. Le camere sono pulite, moderne e con tutto il necessario anche per una visita lunga, dato che è presente anche un angolo cottura.Il personale, in primis la Sig.ra Luana è cortese e disponibile alle richieste dei clienti.La zona ove è ubicata la struttura è tranquilla e non molto rumorosa.Buono anche il servizio di parcheggio interno.Se devo trovare un piccolo neo, è la colazione che viene fornita in camera con prodotti confezionati. Suggerisco al proprietario di pensare ad un collegamento con qualche bar/caffetteria nelle vicinanze.La fermata della metro M1 Rossa si trova a 10 minuti di cammino.",CP Residence,2019-07-05,4 stelle
38,Christian Cp,Una struttura accogliente con camere pulitissime moderne dotate di optional con del personale gentilissimo e sempre disponibile! Il rapporto qualità prezzo é ECCELLENTE! Ottima la posizione vicinissimo alla tangenziale! Dopo molte strutture visitate durante l'anno posso dire che non si trova miglior compromesso!! Di QUALITÀ!  consiglio vivamente,CP Residence,2019-07-05,5 stelle
39,Giovanni I,"residence consigliatissimo, al centro della città immerso nel verde e nella tranquillità a pochi passi dalla metro che vi condurrà al centro di Milano in circa 20 min oppure all'Expo in circa 35.le camere sono organizzate in modo da riuscire ad avere un minimo di privacy pur restando in hotel, molto comode e fornite di tutti i confort incluso un angolo cottura nuovissimo e moderno.Il TV 42'' lcd vi farà compagnia nei momenti di relax in camera.A coronare il tutto ci sarà Silvia la titolare che vi accoglierà e vi consiglierà con una simpatia e professionalità insuperabile.VE LO CONSIGLIO.",CP Residence,2019-07-05,5 stelle
40,Manuela C,"Questo Hotel è situato in una posizione perfetta, per andare in spiaggia non si attraversa neanche la strada. Molto pulito, staff gentilissimo : Mattia ed Andrea persone squisite. La colazione veramente ottima! ",Hotel Nord Est,2019-07-05,5 stelle
41,Dadoreno,"Questo bell’albergo, almeno dall’esterno mi ha attirato, così ho prenotato una notte in matrimoniale. Ci hanno dato una camera angolare, la stanza si può definire decorosa. Pulita. Bagno forse troppo piccolo ed arredamento un po’ datato per questo albergo fermo agli anni ‘90. Personale gentile, colazione migliorabile. Complessivamente tutto bene, anche se un giro ci sono alberghi rinnovati e con un rapporto qualità prezzo tutto sommato forse è più conveniente. Parcheggio un po’ angusto 12€/giorno, anche se prima lo lasci più contenti sono...…",Hotel Nord Est,2019-07-05,3 stelle
42,Marco M,Prima volta a Rimini con un’altra coppia che ha prenotato per noi in questo hotel per loro ormai assodato in qualità. Abbiamo fatto 2 notti molto tranquille nonostante la discoteca accanto. Reception attiva h24 molto efficiente e colazione molto abbondante. Ben rifinito e silenzioso. Anche dal secondo piano ottima vista della costa.…,Hotel Nord Est,2019-07-05,4 stelle
43,ManuelaB521,"Cortesia già al telefono, confermata a pieni voti di persona, quando ad accoglierci troviamo Mattia (o Matteo, non ricordo esattamente il nome), un ragazzo cordiale e gentilissimo che ci mostra attenzione verso la bambina. Benché non fosse alta stagione e non ci fosse il pienone, da segnalare l'ottima ed abbondante colazione. Sottolineo l'ottimo rapporto qualità prezzo! Spero sia così anche in altissima stagione, se i presupposti sono questi è da straconsigliare…",Hotel Nord Est,2019-07-05,5 stelle
44,giove2201,"Accoglienza garbata ma poco edificante per un dettaglio che si sarebbe potuto gestire diversamente. Il posteggio dell'Hotel è a pagamento di un extra considerevole rispetto al prezzo della camera. Le auto con diversamente abili non vengono gestite differentemente dalle altre senza alcuna auspicabile cura, anche considerando che gli accessi facilitati sono nel seminterrato e di pertinenza del cancello carrabile. Detto ciò, più come raccomandazione che come lamentela sottolineo che le camere nostra e dei nostri amici erano molto pulite, carine con arredi moderni e lucidi, vista mare e provviste di asciugamani morbidissimi e profumati. Buon doccia shower e sapone. Peccato per l'asppiratore un po' troppo rumoroso e per il letto ( branda) aggiunto alla tripla con un materasso inadatto al confort minimo di un letto che si rispetti ( sempre un consiglio oltre che una piccola critica che per non aver dormito bene spero ci passerete). Recuperata la situazione con una generosa e qualitativamente soddisfacente colazione a buffet che conferma la categoria superior. Una chicca straordinaria il ""favo di miele"" insieme ai semi, noci, nocciole e altri dressing da yogourteria di alto livello. Davvero, davvero al top credeteci. Personale squisito, puntuale nello sbarazzo e nel rimpiazzo sempre sorridenti . Una nota negativa i tavoli tondi che se ci si appoggia a gomiti si piegano pericolosamente, attenzione. Reception cordiale, preparata, moooolto ma moooooolto cordiale davvero eccellente. Per la recensione sul locale in convenzione per i pasti vedere il Fronte Mare.…",Hotel Nord Est,2019-07-05,3 stelle
45,francesco f,"Abbiamo prenotato in questo hotel per una notte , siamo stati accolti da personale veramente cordiale , hotel pulitissimo e silenzioso , camere comode e munite di tutti i confort, bagni pulitissimi e funzionali , terrazze vista mare 🌊 “si sentono piacevolmente le onde in lontananza “. Colazione abbondante self-service dove trovi di tutto dal dolce al salato in una veranda vista mare .Per me vale la 4A stella e più.Grande ospitalità.",Hotel Nord Est,2019-07-05,4 stelle
46,giorgio s,"Abbiamo soggiornato in settembre con giornate piovose. Le camere sono datate e strette, avevo scelto un 4 stelle nella speranza di trovare camere grandi. La cucina è  anni '80,  il personale è veramente molto gentile, la colazione è degna di nota.È un buon hotel,  da rimodernare un po'.",Hotel Nord Est,2019-07-05,3 stelle
47,Maurizio G,"Frequento questo Hotel da molti anni . Ricordo i proprietari che lo gestivano in maniera meravigliosa . Attualmente il personale femminile della reception  non eccelle per simpatia e disponibilità. Le camere cominciano a sentire il peso degli anni , soprattutto i bagni con muffa e ruggine. Infissi poco isolati e il rumore  della strada ma soprattutto della discoteca affianco non ti fa dormire. Con l'hotel praticamente vuoto nonostante fossero a conoscenza del problema ci hanno dato le stanza proprio da quel lato. Anche a ottobre  per parcheggiare ti fanno pagare 12 euro a notte . Prenotando direttamente solo 8. Non sono disponibili biciclette . Solo la posizione fronte mare e la colazione sono  buone.",Hotel Nord Est,2019-07-05,2 stelle
